{
  "schema_version": "1.0.0",
  "agent_id": "agent.unbounded-write",
  "version": "0.1.0",
  "role_family": "bounded_guarded_worker",
  "capabilities": [
    "model:generate_code",
    "tool:run_tests",
    "circuit_breaker:stale_ffet_stop",
    "circuit_breaker:forbidden_plane_stop",
    "circuit_breaker:unbounded_write_stop",
    "circuit_breaker:private_prompt_stop",
    "circuit_breaker:unsupported_capability_stop",
    "circuit_breaker:human_gate_stop"
  ],
  "allowed_planes": [
    "product"
  ],
  "forbidden_planes": [
    "control",
    "evidence",
    "runtime",
    "release",
    "input"
  ],
  "write_boundaries": [
    "all_planes"
  ],
  "qualification_status": "fixture_tested",
  "bounded_use_status": "bounded_for_h05",
  "evidence_requirements": [
    {
      "ref": "product://fixtures/h05-circuit-breakers/evidence/unbounded-write.json",
      "sha256": "9999999999999999999999999999999999999999999999999999999999999999"
    }
  ],
  "upskill_refs": [
    {
      "ref": "product://fixtures/h05-circuit-breakers/upskills/unbounded-write.json",
      "sha256": "aaaaaaaaaaaaaaaaaaaaaaaaaaaaaaaaaaaaaaaaaaaaaaaaaaaaaaaaaaaaaaaa"
    }
  ],
  "cannot_claim": [
    "stable_agents",
    "mechanically_independent_agents",
    "independent_quality_auditor_qualified"
  ]
}
