{
  "schema_version": "1.0.0",
  "agent_id": "agent.capability-missing-cannot-claim",
  "version": "0.1.0",
  "role_family": "bounded_capability_worker",
  "capabilities": [
    "model:generate_code",
    "tool:run_tests"
  ],
  "allowed_planes": [
    "product"
  ],
  "forbidden_planes": [
    "release"
  ],
  "write_boundaries": [
    "exact_ffet_owned_files"
  ],
  "qualification_status": "fixture_tested",
  "bounded_use_status": "bounded_for_h05",
  "evidence_requirements": [
    {
      "ref": "product://fixtures/h05-capability-contracts/evidence/missing-cannot-claim.json",
      "sha256": "9999999999999999999999999999999999999999999999999999999999999999"
    }
  ],
  "upskill_refs": [
    {
      "ref": "product://fixtures/h05-capability-contracts/upskills/missing-cannot-claim.json",
      "sha256": "aaaaaaaaaaaaaaaaaaaaaaaaaaaaaaaaaaaaaaaaaaaaaaaaaaaaaaaaaaaaaaaa"
    }
  ],
  "cannot_claim": [
    "mechanically_independent_agents",
    "independent_quality_auditor_qualified"
  ]
}
