{
  "schema_version": "1.0.0",
  "agent_id": "agent.private-prompt",
  "version": "0.1.0",
  "role_family": "bounded_capability_worker",
  "capabilities": [
    "model:generate_code",
    "operator_instruction:include_private_prompt"
  ],
  "allowed_planes": [
    "product"
  ],
  "forbidden_planes": [
    "release"
  ],
  "write_boundaries": [
    "exact_ffet_owned_files"
  ],
  "qualification_status": "fixture_tested",
  "bounded_use_status": "bounded_for_h05",
  "evidence_requirements": [
    {
      "ref": "product://fixtures/h05-capability-contracts/evidence/private-prompt.json",
      "sha256": "7777777777777777777777777777777777777777777777777777777777777777"
    }
  ],
  "upskill_refs": [
    {
      "ref": "product://fixtures/h05-capability-contracts/upskills/private-prompt.json",
      "sha256": "8888888888888888888888888888888888888888888888888888888888888888"
    }
  ],
  "cannot_claim": [
    "stable_agents",
    "mechanically_independent_agents",
    "independent_quality_auditor_qualified"
  ]
}
